{
  "formatVersion": "1.0",
  "registryId": "registry.gridmason.dev",
  "countersignRoots": ["root-2024", "root-2025"],
  "publisherCARoots": ["publisher-ca-root"],
  "issuerAllowlist": ["https://accounts.google.com", "https://github.com/login/oauth"],
  "logPublicKeys": ["ed25519:log-key-1"],
  "notBefore": 1704067200000,
  "notAfter": 1735689600000,
  "crossSig": "sig-of-root-2024-over-this-doc"
}
